id,name,desc,url,img_name,domain,domain_short,img_url
6345943d3f497f00122889bb,QuantumTX Pte Ltd,"QuantumTX is a Healthcare company employing its unique Quantum Mitohormesis tech to bring additional benefits of exercise without added stress or strain. QTX is helping seniors everywhere stay fit and healthy, enhancing top-athletes’ performance, and enabling Exercise to be prescribed as Medicine.",www.quantumtx.com,QuantumTX logo 300dpi colour.png,2. Health and Biomedical Sciences,hbms,https://storage.googleapis.com/seeds-capital/edited/6345943d3f497f00122889bb/Question 4 - QuantumTX logo 300dpi colour.png
634609fec2ae6d0012d7112e,AIM Biotech Pte Ltd,"From the most demanding basic research, to predictive screens for drug discovery, to the tailored selection of precision medicines, AIM Biotech's sophisticated microfluidic systems and human tissue models enables and accelerates the development of cutting-edge therapeutics.",https://www.aimbiotech.com/,aim logo text (web DPI).pdf,2. Health and Biomedical Sciences,hbms,https://storage.googleapis.com/seeds-capital/edited/634609fec2ae6d0012d7112e/Question 4 - aim logo text (web DPI).pdf
63462b1ec02c0300115c449e,Zyllem Pte Ltd,"Zyllem is a logistics technology provider that allows enterprises to digitize, optimize & take control over their distribution networks. Zyllem has reduced at least 30% of its customers’ logistics costs, optimize operations via intelligent route planning & achieve visibility over their 3PL partners.",www.zyllem.com,Zyllem Logo_RGB-01.png,3. Services and Digital Economy,sde,https://storage.googleapis.com/seeds-capital/edited/63462b1ec02c0300115c449e/Question 4 - Zyllem Logo_RGB-01.png
63464c8fa368d20012f090f7,PHOTOVOLTAIC FOUNDRY PTE. LTD.,"PvFoundry®️ is an Invent-and-Build solar technology company headquartered in Singapore, leverages on its self-proprietary solar panel product technologies to develop solar assets. We offer full turnkey solution from engineering design, build, operate and maintenance to clients in the region.",www.pvfoundry.com,PvFoundry Company Logo (transparent).png,4. Urban Solutions and Sustainability,uss,https://storage.googleapis.com/seeds-capital/edited/63464c8fa368d20012f090f7/Question 4 - PvFoundry Company Logo (transparent).png
634660e6b74c0b0011aeb5d8,ENDOFOTONICS PTE LTD,Endofotonics is a MedTech company uses its proprietary Raman Spectroscopy platform technology to help clinicians improve early cancer diagnosis. The SPECTRA IMDx™ System is the world’s first and only real-time in-vivo molecular diagnosis using Raman Spectroscopy for Early Gastric Cancer Diagnosis.,www.endofotonics.com,EF logo vector_FINAL_dx tweak_Final.png,2. Health and Biomedical Sciences,hbms,https://storage.googleapis.com/seeds-capital/edited/634660e6b74c0b0011aeb5d8/Question 4 - EF logo vector_FINAL_dx tweak_Final.png
63476da2124ef40013f369e1,ADVANCED BIO MACHINES PTE LTD ( ABM Respiratory Care),"ABM Respiratory Care provides a Modular, Smart platform BiWaze for breathing (ventilation) and maintaining lung health (airway clearance ) which can evolve with needs of the patient through out the disease progression.",www.abmrc.com,ABM_h_r_full_color_rgb_1200px@72ppi.jpg,2. Health and Biomedical Sciences,hbms,https://storage.googleapis.com/seeds-capital/edited/63476da2124ef40013f369e1/Question 4 - ABM_h_r_full_color_rgb_1200px@72ppi.jpg
63479fa4985490001266efd8,Protenga Pte Ltd,"Protenga is a world leader in circular nutrition, making insect innovation accessible for a sustainable future.
We develop data-driven insect technology that produces best-in-class, sustainable nutrition for pet food, feed and plants and enables a circular food system. We make insects work for you!",www.protenga.com,Protenga Logo - 16-9 ratio.png,5. Agrifood Tech,agri,https://storage.googleapis.com/seeds-capital/edited/63479fa4985490001266efd8/Question 4 - Protenga Logo - 16-9 ratio.png
6347b02bc052660012cd585b,LivinWall Pte. Ltd. (Gush),Gush is an advanced building materials company that innovates around materials to solve for indoor air quality and energy efficiency in the built environment.,www.gowithgush.com,logo proportionate.jpg,4. Urban Solutions and Sustainability,uss,https://storage.googleapis.com/seeds-capital/edited/6347b02bc052660012cd585b/Question 4 - logo proportionate.jpg
6347ff93eac17b0012be14f1,MatchMove Pay Pte. Ltd.,"MatchMove is the leading digital business enablement platform built to power the digital economy of South and Southeast Asia. We provide a one-stop, modular, white-label solution for any company’s digitalisation needs, from launching digital sales channels to embedding digital financial services.",https://matchmove.com/,MM logos-02.png,3. Services and Digital Economy,sde,https://storage.googleapis.com/seeds-capital/edited/6347ff93eac17b0012be14f1/Question 4 - MM logos-02.png
6348110ce15db400127034bc,MiyaHealth,"MiyaHealth builds  technology that improves every part of the patient journey. Our 3 product suites MiyaPayor, MiyaPatient, and MiyaProvider enable patients to access affordable healthcare, manage their chronic illness, and help payors and providers improve the patient experience.",https://miyahealth.com/,miya logo green blue - Copy.png,2. Health and Biomedical Sciences,hbms,https://storage.googleapis.com/seeds-capital/edited/6348110ce15db400127034bc/Question 4 - miya logo green blue - Copy.png
634c09d04947300011ce6a7f,6Estates Pte Ltd,"6Estates is a Document AI solution provider, specializing in Multilingual Natural Language Processing (NLP) & Machine Reading Comprehension (MRC) technologies to help customers process unstructured documents to digitalise manual processes.",https://www.6estates.com,6Estates_logo_Tagline_Large300dpi.jpg,3. Services and Digital Economy,sde,https://storage.googleapis.com/seeds-capital/edited/634c09d04947300011ce6a7f/Question 4 - 6Estates_logo_Tagline_Large300dpi.jpg
634ce45145718800123923a0,Aktivolabs,"Aktivolabs helps life and health insurers, reinsurers, financial institutions and corporations to understand their clients’ health in real-time and drive meaningful engagement at scale with customers about health and longevity.",https://www.aktivolabs.com/,Aktivolabs-black-2000x568 (1).png,2. Health and Biomedical Sciences,hbms,https://storage.googleapis.com/seeds-capital/edited/634ce45145718800123923a0/Question 4 - Aktivolabs-black-2000x568 (1).png
634cee1b457188001239b210,Shopmatic Pte Ltd,"Shopmatic enables the entire ecosystem for anyone wanting to sell online. With over a million customers across India & South Asia, Shopmatic empowers SMEs & Micro-entrepreneurs in the digital journey through webstores, conversational & social commerce and marketplaces.",www.goshopmatic.com,Logo- Business is Good.png,3. Services and Digital Economy,sde,https://storage.googleapis.com/seeds-capital/edited/634cee1b457188001239b210/Question 4 - Logo- Business is Good.png
634cfb6645718800123a98aa,Polybee Pte. Ltd.,"Polybee is increasing profits in fresh produce by automating precision pollination and yield forecasts using nano-drones and AI. Our main customers are agriculture input companies, greenhouse co-ops, and indoor vertical farms.",https://www.polybee.co,polybee_logo_normal-01.png,5. Agrifood Tech,agri,https://storage.googleapis.com/seeds-capital/edited/634cfb6645718800123a98aa/Question 4 - polybee_logo_normal-01.png
634cfcca6200220012cd1e75,Structo,"Structo is a 3D printing solutions provider. Using innovative and proprietary technology, we develop novel digital manufacturing solutions to solve challenging manufacturing problems via additive manufacturing hardware, material sciences and automation systems.",https://www.structo3d.com/,Structo_V1_FullColour_WhiteBG_Large_R.png,1. Advanced Manufacturing and Engineering,ame,https://storage.googleapis.com/seeds-capital/edited/634cfcca6200220012cd1e75/Question 4 - Structo_V1_FullColour_WhiteBG_Large_R.png
634cff685ac4f40012e614b1,Alchemy Foodtech,"Alchemy Foodtech is a Singapore-based food innovation company with a mission to “Make Carbs Good” so people can enjoy food & health. Our patented Alchemy Fibre technology helps with Carb & Sugar Control by lowering glycemic index and sugar levels in carb staples, desserts and dairy with great taste.",https://alchemyfoodtech.com/,ALCHEMY LOGO - MAKES CARBS GOOD TAGLINE REGTANGULAR.png,5. Agrifood Tech,agri,https://storage.googleapis.com/seeds-capital/edited/634cff685ac4f40012e614b1/Question 4 - ALCHEMY LOGO - MAKES CARBS GOOD TAGLINE REGTANGULAR.png
634d043be3636e001145fb8d,Pathnova Laboratories Pte Ltd,"Pathnova is a digital pathology startup using AI to enable scalable and early detection of nose cancer and systemic autoimmune disease. As a MOH-licensed clinical laboratory, we are currently involved in the largest nose cancer screening study to date in Singapore.",https://pathnova.com/,PN_600x323_no-annotation.png,2. Health and Biomedical Sciences,hbms,https://storage.googleapis.com/seeds-capital/edited/634d043be3636e001145fb8d/Question 4 - PN_600x323_no-annotation.png
634d1a2cc4300a00133ff583,ceEntek Pte Ltd,"ceEntek started operations in Singapore in 2010 with the target to develop and market Carbon Nano Fibers(CNF) enhanced UHPC2.0 solutions. ceEntek grew 10X from 2020 to 2021 and currently supplies its UHPC for infrastructure repair, roads/bridges, architectural and pre-cast elements, and many others.",https://ceentek.com/,ceEntek White Logo.png,1. Advanced Manufacturing and Engineering,ame,https://storage.googleapis.com/seeds-capital/edited/634d1a2cc4300a00133ff583/Question 4 - ceEntek White Logo.png
634d2fd1b11b2900124c2bef,Nutrition Technologies,Nutrition Technologies manufactures sustainable animal feed ingredients and biofertiliser products. They use a unique combination of microbes and black soldier fly larvae to recycle nutrients from agricultural and food processing waste streams.,https://www.nutrition-technologies.com,White_background_Logo_with_Icon.jpg,5. Agrifood Tech,agri,https://storage.googleapis.com/seeds-capital/edited/634d2fd1b11b2900124c2bef/Question 4 - White_background_Logo_with_Icon.jpg
634d52746eff0c00114bb8cd,SKALE (GrowthDesk),All-In-One Marketing Platform built for Brick and Mortar Businesses,www.skale.today,SKALE Colored Logo.png,3. Services and Digital Economy,sde,https://storage.googleapis.com/seeds-capital/edited/634d52746eff0c00114bb8cd/Question 4 - SKALE Colored Logo.png
634d66d76eff0c00114c4f83,ZERO2.5 BIOTECH PTE. LTD.,Zero2.5 is a Singapore-based spin-off from Temasek Life Sciences Laboratory that designs and manufactures innovative plant-based products & services to deliver clean air. Its air ionizers are capable of producing highly purified air that significantly reduces PM2.5 particles and aerosols in the air.,www.zero2-5.com,logo-official v2.2.png,4. Urban Solutions and Sustainability,uss,https://storage.googleapis.com/seeds-capital/edited/634d66d76eff0c00114c4f83/Question 4 - logo-official v2.2.png
634dbbf9fea62b0012e3ee86,Aevice Health,"Aevice Health develops a connected device platform, the AeviceMD, powered by its proprietary smart wearable stethoscope that helps providers to manage patients with asthma & COPD at home and reduce the risk of hospital admissions.",www.aevice.com,1. Aevice Primary Logo Full Colour.png,2. Health and Biomedical Sciences,hbms,https://storage.googleapis.com/seeds-capital/edited/634dbbf9fea62b0012e3ee86/Question 4 - 1. Aevice Primary Logo Full Colour.png
634e1209f17a5c00135143d6,NACT ENGINEERING PTE LTD,"NACT is in productization of game changing technologies through the form of robotics accessories. We are proficient in supplying drone accessories such as tether drone systems, light core and other devices to strategically enhance drone capability for off-shelf drones or supplying it to drone OEMs.",201620910E,NACT ENGINEERING_cv.jpg,1. Advanced Manufacturing and Engineering,ame,https://storage.googleapis.com/seeds-capital/edited/634e1209f17a5c00135143d6/Question 4 - NACT ENGINEERING_cv.jpg
634e6f586a6ac9001112e5a5,Tria Pte Ltd,"TRIA is an award winning, “close-the-loop” company for packaging solutions - working with clients from concept, development to manufacturing, as well as in lifecycle carbon assessments, to develop an end-end ecosystem that helps them meet their sustainability goals.",tria.solutions,TRIA_logosq.jpg,4. Urban Solutions and Sustainability,uss,https://storage.googleapis.com/seeds-capital/edited/634e6f586a6ac9001112e5a5/Question 4 - TRIA_logosq.jpg
634e914a79c62a0012ea680c,Canopy Pte Ltd,"Canopy is a turnkey and customizable software solution offering anonymous wealth account aggregation, portfolio analytics and client reporting. Covering all asset classes and markets , Canopy does sophisticated investment reporting for family offices and wealth managers.",https://www.canopy.cloud/,171102_Canopy Logo.png,3. Services and Digital Economy,sde,https://storage.googleapis.com/seeds-capital/edited/634e914a79c62a0012ea680c/Question 4 - 171102_Canopy Logo.png
6350b68dafd01c0012a19b32,Imagene Labs,"Imagene Labs aims to be the global leading ‘Precision Health’ company focusing on Skin, Nutrition and Fitness. We provide diagnostics, insights and personalized products and services in both DTC (“direct-to-consumer”) and B2B channels.",https://www.imagenelabs.com,Imagene_Labs_B_Orange.png,2. Health and Biomedical Sciences,hbms,https://storage.googleapis.com/seeds-capital/edited/6350b68dafd01c0012a19b32/Question 4 - Imagene_Labs_B_Orange.png