id,name,desc,url,img_name,domain,domain_short,img_url
62fc6a050405b70012fb0bd1,Tag Team Inc. Pte Ltd,TagTeam builds hardware and software from lasertag to VR/AR software deployed in law enforcement agencies & schools. We launched the VR Chemistry lab where users can simulate experiments safely without chemical. We conduct events using our proprietary Lasertag system that offers live scoring.,https://tagteaminc.sg/,TAG TEAM logo text (BW backgrd)_v1.png,3. Services and Digital Economy,sde,https://storage.googleapis.com/seeds-capital/edited/62fc6a050405b70012fb0bd1/Question 4 - TAG TEAM logo text (BW backgrd)_v1.png
62fc6ff393b6890012a86dd5,Mesh Bio,Mesh Bio is a healthtech startup addressing the global burden of chronic metabolic diseases. Mesh Bio provides clinical decision support predicitive analytics and automation solutions for patient management; enabling data driven care delivery and precision patient intervention at scale.,www.meshbio.com,Mesh Bio Logo Horizontal.png,2. Health and Biomedical Sciences,hbms,https://storage.googleapis.com/seeds-capital/edited/62fc6ff393b6890012a86dd5/Question 4 - Mesh Bio Logo Horizontal.png
62fc79718df3600012bd5959,uHoo,"uHoo is a climate-tech SaaS company that monitors and manages the indoor environment of homes and buildings to help them improve health and wellbeing, decarbonize and enhance their ESG performance. We do this using our patented sensors, calibration algorithms and software.",https://getuhoo.com,logo.png,4. Urban Solutions and Sustainability,uss,https://storage.googleapis.com/seeds-capital/edited/62fc79718df3600012bd5959/Question 4 - logo.png
62fc9bd78df3600012c113b2,Turnkey Lender Private Limited,"TurnKey Lender is a global B2B SaaS company that offers AI-powered lending automation and decision management solutions in 50+ countries and counting. From origination and underwriting, to servicing, collection, and reporting, the award-winning software automates every step of the lending process.",https://www.turnkey-lender.com/,TKL logo compact light.png,3. Services and Digital Economy,sde,https://storage.googleapis.com/seeds-capital/edited/62fc9bd78df3600012c113b2/Question 4 - TKL logo compact light.png
62fca58e0386aa00121e43f2,Willowmore Pte. Ltd.,Willowmore is a Singapore-based startup specializing in the internet of things that provides keyless smart locks and the accompanying software for the devices.,www.willowmore.com.sg,Willowmore_Logo_Final_Colour.png,4. Urban Solutions and Sustainability,uss,https://storage.googleapis.com/seeds-capital/edited/62fca58e0386aa00121e43f2/Question 4 - Willowmore_Logo_Final_Colour.png
62fca84629f49e001390ed14,Novade Solutions,"Novade is the leading construction management software for the building and infrastructure industry. Site processes including quality, safety, and progress monitoring are digitised and automated using mobile devices. The data captured provides insights to streamline operations and drive results.",www.novade.net,Novade Logo.png,3. Services and Digital Economy,sde,https://storage.googleapis.com/seeds-capital/edited/62fca84629f49e001390ed14/Question 4 - Novade Logo.png
62fcf30f29f49e001395a021,PHOTOVOLTAIC FOUNDRY PTE. LTD.,"PvFoundry®️ is an Invent-and-Build solar technology company headquartered in Singapore since 2016 specialize in solar module design & customization, offer full turnkey solutions including project design, supply, installation, maintenance, and PPA for rooftop solar system development.",www.pvfoundry.com,PvFoundry Logo JPEG.jpg,4. Urban Solutions and Sustainability,uss,https://storage.googleapis.com/seeds-capital/edited/62fcf30f29f49e001395a021/Question 4 - PvFoundry Logo JPEG.jpg
62fcf56c2c1e91001304c5b2,Blue Fire AI,"Blue Fire AI is a AI powered financial services firm. We monitor 12,000 listed companies globally to unforeseen risk that is not yet reflected in equity and debt security prices of target companies. BFAI serves global pension funds, sovereign wealth funds, banks and asset managers.",https://bluefireai.com/,Logo.jpg,3. Services and Digital Economy,sde,https://storage.googleapis.com/seeds-capital/edited/62fcf56c2c1e91001304c5b2/Question 4 - Logo.jpg
62fd25a208b16f001375a8ff,Hyroleap pte Ltd,Hydroleap is a deeptech singapore-based startup focused on industrial wastewater treatment with an innovative and environmentally friendly approach using electricity instead of chemicals.,https://hydroleap.com/,Hydroleap_logo_White Background.jpg,4. Urban Solutions and Sustainability,uss,https://storage.googleapis.com/seeds-capital/edited/62fd25a208b16f001375a8ff/Question 4 - Hydroleap_logo_White Background.jpg
62fd441129f49e0013972137,Wittaya Aqua,"Wittaya Aqua is a software and service company that helps aquaculture farms, feed and feed ingredient companies use data to make better decisions.  Our mission is to help increase global seafood production in a sustainable and ethical manner.",https://wittaya-aqua.ca/,Wittaya-Aqua.png,5. Agrifood Tech,agri,https://storage.googleapis.com/seeds-capital/edited/62fd441129f49e0013972137/Question 4 - Wittaya-Aqua.png
62fd9a4f2c1e9100130923b4,Zuno Carbon,"Zuno Carbon provides end-to-end carbon management solutions that enables organizations to measure, report, and ultimately reduce their environmental impact.",https://zunocarbon.com/,1. Zuno Carbon Logo_Official_Transparent.png,4. Urban Solutions and Sustainability,uss,https://storage.googleapis.com/seeds-capital/edited/62fd9a4f2c1e9100130923b4/Question 4 - 1. Zuno Carbon Logo_Official_Transparent.png
62fdad2893b6890012b90b8b,AWAK Technologies,"AWAK is a patient-centric medical technology company with a mission to enhance the lives of people with kidney disease and their caregivers, by providing solutions to deliver better outcomes along with improving their quality of life.",www.awak.com,AWAK LOGO_with tagline.png,2. Health and Biomedical Sciences,hbms,https://storage.googleapis.com/seeds-capital/edited/62fdad2893b6890012b90b8b/Question 4 - AWAK LOGO_with tagline.png
62fde95529f49e0013a1c401,Sleek,"Sleek enables entrepreneurs and investors around the world to quickly register their business and manage their accounting, tax compliance, payments and governance needs effortlessly using a simple, all-in-one, fully digital platform. Sleek is trusted by over 450,000 businesses globally.",https://sleek.com/,LOGO.png,3. Services and Digital Economy,sde,https://storage.googleapis.com/seeds-capital/edited/62fde95529f49e0013a1c401/Question 4 - LOGO.png
62fe0df40386aa00123317ad,AIDA Technologies,"A award-winning specialist AI/ML company providing solutions to health insurance companies in the areas of productivity improvements (automation), fraud detection and revenue enhancements (upsell and cross selling).",www.aidatech.io,AIDA_Logo HighRes copy.png,3. Services and Digital Economy,sde,https://storage.googleapis.com/seeds-capital/edited/62fe0df40386aa00123317ad/Question 4 - AIDA_Logo HighRes copy.png
62fe5fee3e0e3700129f41b6,Ligature Therapeutics Pte Ltd,"Ligature Therapeutics Pte. Ltd. (LTx) is an early-stage biotech company generating targeted protein degraders (TPD). LTx is advancing its structure agnostic fragment-based drug discovery platform to generate cancer-selective TPDs, and has achieved early proof of concept with a lead asset.",https://ligaturetx.com/,LigatureTx_Logo_RGB.jpg,2. Health and Biomedical Sciences,hbms,https://storage.googleapis.com/seeds-capital/edited/62fe5fee3e0e3700129f41b6/Question 4 - LigatureTx_Logo_RGB.jpg
62feedb593b6890012c96641,Crayon Data Pte Ltd,Data & AI company deploying AI-led platform solution to enterprises. Drive customer engagement through personalised experience with the vision to simplify world's choice,https://www.crayondata.com/,CD logo.png,3. Services and Digital Economy,sde,https://storage.googleapis.com/seeds-capital/edited/62feedb593b6890012c96641/Question 4 - CD logo.png
62ff53260386aa001243ccf3,JN Medsys Pte. Ltd.,"JN Medsys is a Singapore biomedical company providing genomic tools for precise & personalized diagnostics. Our genomic tools comprise instruments and kits that provide better sensitivity and accuracy for nucleic acid analysis, to generate actionable insights in clinical diagnostics.",www.jnmedsys.com,JN-Medsys-High-Resolution-01 crop.png,1. Advanced Manufacturing and Engineering,ame,https://storage.googleapis.com/seeds-capital/edited/62ff53260386aa001243ccf3/Question 4 - JN-Medsys-High-Resolution-01 crop.png
62ffe8bcf87eed0012395592,Arcstone,"Arcstone is a leading manufacturing software company with a mission to provide complete manufacturing transparency across the entire supply chain. Arcstone aims to simplify Industry 4.0 and enable a more responsive, responsible, and sustainable manufacturing ecosystem for everyone.",https://www.arcstone.co,Arcstone_Data Makes It Better_Original Color-06.png,1. Advanced Manufacturing and Engineering,ame,https://storage.googleapis.com/seeds-capital/edited/62ffe8bcf87eed0012395592/Question 4 - Arcstone_Data Makes It Better_Original Color-06.png
6300552e8df3600012eda34e,HealthBeats Pte Ltd,"HealthBeats is a subscription-based RPM platform designed to provide simple-to-use and simple-to-deploy solution for patients and providers. Our end-to-end solution includes regulatory approved medical devices, software platform and comprehensive support services that allow peace of mind to users",www.healthbeats.co,HB-Logo w Tagline 800x800.png,2. Health and Biomedical Sciences,hbms,https://storage.googleapis.com/seeds-capital/edited/6300552e8df3600012eda34e/Question 4 - HB-Logo w Tagline 800x800.png
63030f953e0e370012c6ae12,impress.ai,"impress.ai is a leading end-to-end recruitment SaaS platform provider with a focus on making accurate hiring easier. impress.ai helps enterprises screen, engage, and hire the best talent with accuracy, consistency, & efficiency.",https://impress.ai/,impress logo.png,3. Services and Digital Economy,sde,https://storage.googleapis.com/seeds-capital/edited/63030f953e0e370012c6ae12/Question 4 - impress logo.png
63044d3e2c1e910013524e58,BeMyGuest Pte Ltd,"BeMyGuest are pioneers in the travel experiences category in APAC. The multiple award-winning company offers operators of all sizes a distribution platform and a booking system that facilitate the digital sale of their activities, tours, attraction tickets, transfers, events and other services.",https://bemyguest.com.sg/,BMG Logo 1280x720.png,3. Services and Digital Economy,sde,https://storage.googleapis.com/seeds-capital/edited/63044d3e2c1e910013524e58/Question 4 - BMG Logo 1280x720.png
630493db0386aa0012780a82,Zenyum,"Zenyum stands for delivering excellent Smile Cosmetics products that stand out in a competitive environment and make us proud. 
A lot of the value which we derive comes from great and proven technology, paired with cutting-edge design and brand communication.",https://www.zenyum.com/sg-en,logo.png,2. Health and Biomedical Sciences,hbms,https://storage.googleapis.com/seeds-capital/edited/630493db0386aa0012780a82/Question 4 - logo.png
63049ecf08b16f0013c9b9e2,JULES Corporation,"JULES is a Social Enterprise and EdTech startup. We created the world’s first proprietary “School of Fish” Curriculum, teaching preschool children Computational Thinking and gives children a start to acquiring life-long foundational critical thinking and problem-solving skills.",https://www.jules.education/,JULES_Vertical Logo.jpg,3. Services and Digital Economy,sde,https://storage.googleapis.com/seeds-capital/edited/63049ecf08b16f0013c9b9e2/Question 4 - JULES_Vertical Logo.jpg
63057d232849920013fbbfac,SpaceAge Labs,"SpaceAge labs help cities, utilities, OEMs and industrial customers use real time sensor data and IoT / AI based insights to sustainably manage remote and distributed water & greenery assets such as sewers, drains, lawns, pipes, trees and decentralised water skids.",https://www.spaceage-labs.com/,SAL_Color_Logo_transparent bg.png,1. Advanced Manufacturing and Engineering,ame,https://storage.googleapis.com/seeds-capital/edited/63057d232849920013fbbfac/Question 4 - SAL_Color_Logo_transparent bg.png
6305e63c93b68900121b2050,Pedra Technology,"Supported by two strategics with a global footprint, our perfusion monitor has achieved FDA's Breakthrough Device Designation.  Our goal is to be part of every peripheral balloon angioplasty or bypass procedure, as we seek to improve limb salvage in the treatment of peripheral artery disease.",https://www.pedratech.com/,Pedra Logo - white background and black font.png,2. Health and Biomedical Sciences,hbms,https://storage.googleapis.com/seeds-capital/edited/6305e63c93b68900121b2050/Question 4 - Pedra Logo - white background and black font.png
6305f78b2c1e9100136ee685,Lumos Labs Pte Ltd,"We are on a mission to protect a million heads. Lumos is a next-generation bicycle helmet with integrated lights, brake, and turn signals. Lumos is redefining the role of a helmet and what it can do. We aim to make Lumos the “Apple” of helmets.",https://lumoshelmet.co/,Logo Black.png,1. Advanced Manufacturing and Engineering,ame,https://storage.googleapis.com/seeds-capital/edited/6305f78b2c1e9100136ee685/Question 4 - Logo Black.png
6306f3273e0e370012ff5355,Silver Factory Technology Pte Ltd,Silver Factory Technology aims to provide high quality plasmonic nanoparticles and customised nanoparticles for various industries. We are also actively co-developing novel materials and nanoparticle products through collaborations.,https://silverfactorytechnology.com/,SFT New Logo.png,1. Advanced Manufacturing and Engineering,ame,https://storage.googleapis.com/seeds-capital/edited/6306f3273e0e370012ff5355/Question 4 - SFT New Logo.png
630710c828499200131468f7,Nugit Pte Ltd,Nugit is an SG-based Saas Tech Platform that provides Data Analytics and Storytelling capabilities to its clients.,https://www.nugit.co/,nugit logo black.jpeg,3. Services and Digital Economy,sde,https://storage.googleapis.com/seeds-capital/edited/630710c828499200131468f7/Question 4 - nugit logo black.jpeg
63073be20386aa00129dc495,Zero Error Systems Pte Ltd,"Zero-Error Systems Pte Ltd (ZES), founded in March 2019, is a deep-tech spin-off from Nanyang Technological University (NTU), Singapore.

The company is addressing unresolved critical problems related to radiation impact and reliable power-efficiency found e.g., in Space, Automotive, and 5G/IoT.",https://zero-errorsystems.com/,ZES Logo.png,1. Advanced Manufacturing and Engineering,ame,https://storage.googleapis.com/seeds-capital/edited/63073be20386aa00129dc495/Question 4 - ZES Logo.png
6307455a0386aa00129e8a5f,Avanseus Holdings Pte. Ltd,"Avanseus is a leading technology and software innovator in enterprise solutions driven by analytics, artificial intelligence, machine learning and cognitive computing for large-scale technology infrastructure management.",www.avanseus.com,avanseus_logo-01.png,3. Services and Digital Economy,sde,https://storage.googleapis.com/seeds-capital/edited/6307455a0386aa00129e8a5f/Question 4 - avanseus_logo-01.png
630998510386aa0012b550ab,VersaFleet,"VersaFleet’s enterprise transport management software (TMS SaaS) automates the world’s logistics operations by digitalising supply chains ground up, simplifying day-to-day ops for FMCG and retail brands worldwide.",VersaFleet.co,Logo Primary.png,4. Urban Solutions and Sustainability,uss,https://storage.googleapis.com/seeds-capital/edited/630998510386aa0012b550ab/Question 4 - Logo Primary.png
630c60f12849920013441626,Sentient.io Pte. Ltd,We operate an AI & Data secure platform that allows software developers to collaborate on augmenting algorithms through a blend of in-house and external models. We provide ready-made models for easy-adoption and turnkey AI solutions for enterprises at every stage of their digitalisation journey.,https://www.sentient.io/en/,SentientIO logo-rgb-portrait (2).png,3. Services and Digital Economy,sde,https://storage.googleapis.com/seeds-capital/edited/630c60f12849920013441626/Question 4 - SentientIO logo-rgb-portrait (2).png
630c65cc08b16f00131ac4c8,Qritive,"Qritive makes cancer diagnosis fast, accurate, and affordable through AI powered tools for pathology.",qritive.com,QritiveLogoHiRes_Colour.png,2. Health and Biomedical Sciences,hbms,https://storage.googleapis.com/seeds-capital/edited/630c65cc08b16f00131ac4c8/Question 4 - QritiveLogoHiRes_Colour.png
630c75d10405b70012add29e,Krosslinker Private Limited,"Krosslinker is a deep-tech cleantech startup based in Singapore. We develop advanced energy-efficient material, 'aerogel' for the thermal insulation applications in cold-chain, construction, industrial insulation, energy infrastructure, automotive, textile, EV battery industry.",https://krosslinker.com/,KrossLinker Logo JPEG.jpg,1. Advanced Manufacturing and Engineering,ame,https://storage.googleapis.com/seeds-capital/edited/630c75d10405b70012add29e/Question 4 - KrossLinker Logo JPEG.jpg
630cc0a028499200134b1d28,Movel AI Pte Ltd,"Movel AI is an up and coming robotic navigation software startup from Singapore. Combining sensor fusion, AI, vision and machine learning technologies, we deliver human-like precision and movements to robots to speed up the adoption of robotics across various industries in different continents.",www.move.ai,Movel AI Logo (Hi-res).jpg,1. Advanced Manufacturing and Engineering,ame,https://storage.googleapis.com/seeds-capital/edited/630cc0a028499200134b1d28/Question 4 - Movel AI Logo (Hi-res).jpg
630ce0d92c1e910013b31993,Hubble.Build,"Hubble.Build is the leading digital technology provider in the construction industry. With years of experience in data science, they aim to transform our industry to build the world’s first autonomous construction site via their award winning all-in-one construction management digital platform.",https://hubble.build/,Hubble.Build Logo (Dark Double Row).png,3. Services and Digital Economy,sde,https://storage.googleapis.com/seeds-capital/edited/630ce0d92c1e910013b31993/Question 4 - Hubble.Build Logo (Dark Double Row).png
630d82f508b16f001327af42,Oncoshot Pte Ltd,The Oncoshot platform serves as a bridge between leading regional healthcare institutions and contract research organizations and global biotechnology and pharmaceutical companies to facilitate data-driven cancer clinical trials while accelerating enrolment into actively recruiting ones.,https://www.oncoshot.com/,Oncoshot-logo.png,2. Health and Biomedical Sciences,hbms,https://storage.googleapis.com/seeds-capital/edited/630d82f508b16f001327af42/Question 4 - Oncoshot-logo.png
630d8ef40386aa0012d85723,MooVita Pte Ltd,"Founded in Singapore in 2016, MooVita is a high-tech provider of smart mobility solutions for urban environments. MooVita offers vehicle-agnostic, driverless software capabilities for many urban driving solutions. MooVita's solutions can be deployed across industrial parks and residential estates.",http://www.moovita.com/,MooVita(slogan)_logo.png,4. Urban Solutions and Sustainability,uss,https://storage.googleapis.com/seeds-capital/edited/630d8ef40386aa0012d85723/Question 4 - MooVita(slogan)_logo.png
630ee3600af0c4001264ae7f,Transcelestial,"Transcelestial is building the future of internet distribution, with the ultimate goal of building a space laser network to deliver a step-change in internet connectivity globally.",www.transcelestial.com,Transcelestial - Blue logo.pdf,4. Urban Solutions and Sustainability,uss,https://storage.googleapis.com/seeds-capital/edited/630ee3600af0c4001264ae7f/Question 4 - Transcelestial - Blue logo.pdf
63106ebba71dde001301dac4,Mycovation Pte. Ltd.,"Mycovation is a fermentation technology company that transforms mycelium into novel and bespoke ingredients for plant-based foods. We have 2 products known as MyX and MyMic. MyX is a fermented flour that improves flavour, texture, and nutrition whereas MyMic is a protein-rich base ingredient.",https://www.mycovation.asia/,Mycovation_Logo.png,5. Agrifood Tech,agri,https://storage.googleapis.com/seeds-capital/edited/63106ebba71dde001301dac4/Question 4 - Mycovation_Logo.png
6312d174137da7001248566a,Singrow Pte Ltd,"Singrow is a Singapore-based Farming As A Service (FaaS) company with core IPs of proprietary crops varieties, novel growing protocol, and patented precision agriculture system. With it's unique business model, Singrow has served franchise and contract farms, hotels and offices, in ASEAN and China.",https://www.singrow.net/,Singrow_Logo-01.jpg,5. Agrifood Tech,agri,https://storage.googleapis.com/seeds-capital/edited/6312d174137da7001248566a/Question 4 - Singrow_Logo-01.jpg
6315cbb38b545c0012133e2e,Biorithm,"Biorithm is a global women's health start up that aims to enhance quality and access to care for women. 

Through femom, designed for remote monitoring of maternal & fetal parameters, Biorithm aims to end preventable pregnancy complications & stillbirth through predictive and precision medicine.",https://www.bio-rithm.com,Biorithm logo.png,2. Health and Biomedical Sciences,hbms,https://storage.googleapis.com/seeds-capital/edited/6315cbb38b545c0012133e2e/Question 4 - Biorithm logo.png
631ac0a4214e700011dcd823,GlobalTix Pte Ltd,"GlobalTix is a technology and distribution player in Asia focused on providing end-to-end solutions for attractions, tours and activities partners to manage and grow their tourism business and seamlessly connect tourist activities to travellers around the globe.",https://www.globaltix.com/,GT logo.png,3. Services and Digital Economy,sde,https://storage.googleapis.com/seeds-capital/edited/631ac0a4214e700011dcd823/Question 4 - GT logo.png
631edbe28b545c001271665d,Adatos Pte Ltd,"The company's technology develops and deploys autonomous artificial intelligence tools to analyze and draw insights from remotely sensed data, to enable measuring and analysing of agriculture and ecosystems to account for: crop conditions yield prediction, crop price prediction and carbon credit.",https://www.adatos.ai,ADATOS-AI_logo.png,3. Services and Digital Economy,sde,https://storage.googleapis.com/seeds-capital/edited/631edbe28b545c001271665d/Question 4 - ADATOS-AI_logo.png
6320543bab174b0012021ae6,Aqualita Ecotechnology Pte Ltd,"Aqualita is on a mission to optimise solutions for urban aquaculture production through best-in-class differentiators and integrated risk management. Via a patented recirculating aquaculture system technology, our modular and versatile innovations facilitate higher efficiency and better outcomes.",TBC,Aqualita New Logo.png,5. Agrifood Tech,agri,https://storage.googleapis.com/seeds-capital/edited/6320543bab174b0012021ae6/Question 4 - Aqualita New Logo.png
6344eec444f0b500125f9267,Propine Technologies Pte. Ltd.,"MAS-licensed, ISO 27001-certified Propine offers digital securities, cryptocurrencies, stablecoins, NFTs, and fiat custody on a single integrated platform. We provide fiat on and off ramps, secure connections to yield-generating DeFi solution providers, end-to-end tokenization and issuance services.",https://propine.com/,RGB.png,3. Services and Digital Economy,sde,https://storage.googleapis.com/seeds-capital/edited/6344eec444f0b500125f9267/Question 4 - RGB.png
6345108cc02c0300114ccf1d,impress.ai,"impress.ai is a leading end-to-end recruitment SaaS platform provider focusing on making accurate hiring easier. Powered by AI, impress.ai’s platform helps enterprises screen, engage, and hire the best talent with accuracy, consistency, & efficiency.",http://impress.ai/,impress logo.png,3. Services and Digital Economy,sde,https://storage.googleapis.com/seeds-capital/edited/6345108cc02c0300114ccf1d/Question 4 - impress logo.png
6345164345da1000126e6099,Alterpacks,"Alterpacks upcycles food disposed by manufacturers to replace plastic food containers.  Their proprietary tech uses spent grains, made of malt and cereals after milo or beer has been processed to create bio-pellets and bio-sheet products for sustainable packaging solutions that are home compostable.",https://alterpacks.com/,alterpacks-300x300px 2.eps,4. Urban Solutions and Sustainability,uss,https://storage.googleapis.com/seeds-capital/edited/6345164345da1000126e6099/Question 4 - alterpacks-300x300px 2.eps
63451bbac02c0300114e44f2,Speedcargo Technologies Pte Ltd.,"Speedcargo Technologies brings innovative solutions with computer vision technologies, advanced algorithms and artificial intelligence to transform the air cargo operations of Airlines and Ground Handlers.",https://www.speedcargo.sg/,SPEEDCARGO_blck.png,3. Services and Digital Economy,sde,https://storage.googleapis.com/seeds-capital/edited/63451bbac02c0300114e44f2/Question 4 - SPEEDCARGO_blck.png
63452a66a368d20012e0d897,Style Theory Pte. Ltd.,Style Theory is Southeast Asia's leading circular fashion platform for designer bags and apparel. Members can rent unlimited well-made bags and clothes from slow fashion and luxury brands for a fixed monthly subscription price.,styletheory.co,logo_web_resolution_black copy.png,3. Services and Digital Economy,sde,https://storage.googleapis.com/seeds-capital/edited/63452a66a368d20012e0d897/Question 4 - logo_web_resolution_black copy.png
63456872a368d20012e5eab3,Riverr ptd. ltd.,"Riverr connects the world’s health data. The platform solves fragmentation that have held back AI and patient-level data collaboration in the past, giving healthcare organisations the ability to make accurate, explainable, and actionable predictions of individual-level health risks.",https://riverr.ai/,Riverr_logo_16_9format.png,2. Health and Biomedical Sciences,hbms,https://storage.googleapis.com/seeds-capital/edited/63456872a368d20012e5eab3/Question 4 - Riverr_logo_16_9format.png
